{
  "format": {
    "version": "1.0"
  },
  "source": {
    "files": [
      "Alu.scala"
    ],
    "language": "Chisel"
  },
  "target": {
    "files": [
      "Alu.sv"
    ],
    "language": "SystemVerilog"
  },
  "types": {
    "Alu_io": {
      "kind": "struct",
      "members": [
        {
          "flipped": true,
          "name": "a",
          "typeRef": "uint8"
        },
        {
          "flipped": true,
          "name": "b",
          "typeRef": "uint8"
        },
        {
          "flipped": true,
          "name": "op",
          "typeRef": "Op$"
        },
        {
          "name": "out",
          "typeRef": "uint8"
        }
      ],
      "source": {
        "name": "AluIO"
      }
    },
    "Op$": {
      "kind": "enum",
      "source": {
        "name": "Op"
      },
      "underlyingTypeRef": "uint3",
      "variants": {
        "0": "Add",
        "1": "Sub",
        "2": "And"
      }
    },
    "bool": {
      "kind": "uint",
      "width": 1
    },
    "uint3": {
      "kind": "uint",
      "width": 3
    },
    "uint8": {
      "kind": "uint",
      "source": {
        "name": "UInt<8>"
      },
      "width": 8
    }
  },
  "modules": {
    "Alu": {
      "variables": {
        "io": {
          "source": {
            "loc": {
              "beginColumn": 14,
              "beginLine": 13,
              "file": 0
            },
            "x-chisel": {
              "binding": "IO"
            }
          },
          "target": {
            "verilog": {
              "a": "io_a",
              "b": "io_b",
              "op": "io_op",
              "out": "io_out"
            }
          },
          "typeRef": "Alu_io"
        }
      }
    },
    "Cpu": {
      "source": {
        "x-chisel": {
          "params": [
            {
              "name": "width",
              "type": "Int",
              "value": "8"
            }
          ],
          "type_name": "Cpu"
        }
      },
      "variables": {
        "acc": {
          "source": {
            "loc": {
              "beginColumn": 22,
              "beginLine": 25,
              "file": 0
            },
            "x-chisel": {
              "binding": "Reg"
            }
          },
          "target": {
            "verilog": "acc"
          },
          "typeRef": "uint8"
        },
        "clock": {
          "direction": "input",
          "source": {},
          "target": {
            "verilog": "clock"
          },
          "typeRef": "bool"
        },
        "io_a": {
          "direction": "input",
          "source": {},
          "target": {
            "verilog": "io_a"
          },
          "typeRef": "uint8"
        },
        "io_b": {
          "direction": "input",
          "source": {},
          "target": {
            "verilog": "io_b"
          },
          "typeRef": "uint8"
        },
        "io_op": {
          "direction": "input",
          "source": {},
          "target": {
            "verilog": "io_op"
          },
          "typeRef": "uint3"
        },
        "io_out": {
          "direction": "output",
          "source": {},
          "target": {
            "verilog": "io_out"
          },
          "typeRef": "uint8"
        },
        "reset": {
          "direction": "input",
          "source": {},
          "target": {
            "verilog": "reset"
          },
          "typeRef": "bool"
        }
      },
      "instances": {
        "alu": {
          "moduleRef": "Alu",
          "source": {
            "loc": {
              "beginColumn": 20,
              "beginLine": 22,
              "file": 0
            },
            "x-chisel": {
              "params": [
                {
                  "name": "width",
                  "type": "Int",
                  "value": "8"
                }
              ],
              "type_name": "Alu"
            }
          }
        }
      }
    }
  }
}
